Description_lang,Title_lang,Reward_lang,ID,Instance_ID,Faction,Supercedes,Category,Minimum_criteria,Points,Flags,Ui_order,IconFileID,Criteria_tree,Shares_criteria
"Vaincre le léviathan des flammes alors que 4 systèmes de défense orbitaux sont encore actifs en mode 25 joueurs.","Laissez l'orbite tranquille (25 joueurs)",,3057,603,-1,2917,14962,0,10,0,14,134430,129404,0
"Vaincre le déconstructeur XT-002 après avoir détruit son cœur en mode 10 joueurs.","Bourreau des cœurs (10 joueurs)",,3058,603,-1,0,14961,0,10,0,24,135455,129406,0
"Vaincre le déconstructeur XT-002 après avoir détruit son cœur en mode 25 joueurs.","Bourreau des cœurs (25 joueurs)",,3059,603,-1,0,14962,0,10,0,24,135455,133036,0
"Vaincre le défenseur farouche pendant le combat contre Auriaya en mode 10 joueurs.","Neuf vies (10 joueurs)",,3076,603,-1,0,14961,0,10,0,35,132225,129408,0
"Vaincre le défenseur farouche pendant le combat contre Auriaya en mode 25 joueurs.","Neuf vies (25 joueurs)",,3077,603,-1,0,14962,0,10,0,35,132225,129410,0
"Obtenir le wyrm de givre du gladiateur fatal de la cinquième saison d'arène de Wrath of the Lich King.","Wyrm de givre du gladiateur fatal",,3096,-1,-1,0,81,1,0,0,137,303868,132445,0
"Détruire 100 défenseurs d'acier forgé en 10 secondes au cours de l'épreuve d'Ulduar en mode 10 joueurs.","Exterminaintion (10 joueurs)",,3097,603,-1,0,14961,0,10,0,6,4344094,126419,0
"Détruire 100 défenseurs d'acier forgé en 10 secondes au cours de l'épreuve d'Ulduar en mode 25 joueurs.","Exterminaintion (25 joueurs)",,3098,603,-1,0,14962,0,10,0,6,4344094,126421,0
"Avoir participé au premier raid du royaume ayant vaincu Yogg-Saron sans l’aide des gardiens en mode 25 joueurs après avoir vaincu l’assemblée du Fer et tous les gardiens en mode difficile.","Faucheur de la Mort « Prem's » du royaume","Titre : faucheur de la Mort",3117,603,-1,0,81,0,0,768,69,254105,132264,0
"Vaincre l'ancien Brillefeuille, l'ancien Branchefer et l'ancien Ecorcepierre à 15 secondes d'intervalle les uns des autres en mode 25 joueurs.","Ça fera du bois pour l'hiver (25 joueurs)",,3118,603,-1,0,14962,1,10,0,46,132129,129584,0
"Vaincre Emalon le Guetteur d'orage à 10.","Emalon le Guetteur d'orage (10 joueurs)",,3136,624,-1,0,14901,0,10,0,18,134452,124930,0
"Vaincre Emalon le Guetteur d'orage à 25.","Emalon le Guetteur d'orage (25 joueurs)",,3137,624,-1,0,14901,0,10,0,19,134452,124932,0
"Forcer Mimiron à tuer un robot d'assaut avec une frappe de fusée en mode 10 joueurs.","Un tir pas si amical que ça (10 joueurs)",,3138,603,-1,0,14961,0,10,0,54,133032,131460,0
"Vaincre Yogg-Saron avec l'aide de deux gardiens ou moins en mode 10 joueurs.","Deux lumières dans la nuit (10 joueurs)",,3141,603,-1,3157,14961,0,10,0,60,136194,131462,0
"S'équiper de Val'anyr, le marteau des anciens rois.","Val'anyr, le marteau des anciens rois",,3142,-1,-1,0,81,0,0,0,149,253399,131974,0
"Vaincre Yogg-Saron avec l'aide de trois gardiens ou moins en mode 10 joueurs.","Trois lumières dans la nuit (10 joueurs)",,3157,603,-1,0,14961,0,10,0,59,136194,128657,0
"Vaincre Yogg-Saron avec l'aide d'un seul gardien ou moins en mode 10 joueurs.","Une lumière dans la nuit (10 joueurs)",,3158,603,-1,3141,14961,0,10,0,61,136194,128659,0
"Vaincre Yogg-Saron sans l'aide d'un seul gardien en mode 10 joueurs.","Dans la nuit noire (10 joueurs)",,3159,603,-1,3158,14961,0,10,0,62,136194,132448,0
"Vaincre Yogg-Saron avec l'aide de trois gardiens ou moins en mode 25 joueurs.","Trois lumières dans la nuit (25 joueurs)",,3161,603,-1,0,14962,0,10,0,59,136194,129063,0
"Vaincre Yogg-Saron avec l'aide de deux gardiens ou moins en mode 25 joueurs.","Deux lumières dans la nuit (25 joueurs)",,3162,603,-1,3161,14962,0,10,0,60,136194,129065,0
"Vaincre Yogg-Saron avec l'aide d'un seul gardien ou moins en mode 25 joueurs.","Une lumière dans la nuit (25 joueurs)",,3163,603,-1,3162,14962,0,10,0,61,136194,129367,0
"Vaincre Yogg-Saron sans l'aide d'un seul gardien en mode 25 joueurs.","Dans la nuit noire (25 joueurs)",,3164,603,-1,3163,14962,0,10,0,62,136194,143606,0
"Vaincre Thorim alors que Sif est présente en mode 10 joueurs.","Bercés d'illusions (10 joueurs)",,3176,603,-1,2977,14961,0,10,0,45,298676,129977,0
"Vaincre Freya alors qu'au moins un ancien est encore vivant en mode 10 joueurs.","L'arbre qui cache la Freya (10 joueurs)",,3177,603,-1,0,14961,0,10,0,50,236437,129979,0
"Vaincre Freya alors qu'au moins deux anciens sont encore vivants en mode 10 joueurs.","Les arbres qui cachent la Freya (10 joueurs)",,3178,603,-1,3177,14961,0,10,0,51,236437,133038,0
"Vaincre Freya alors que les trois anciens sont encore vivants en mode 10 joueurs.","Tous les arbres qui cachent la Freya (10 joueurs)",,3179,603,-1,3178,14961,0,10,0,52,236437,128122,0
"Vaincre Mimiron après avoir activé son mécanisme d'autodestruction en mode 10 joueurs.","Ne jamais toucher au bouton rouge (10 joueurs)",,3180,603,-1,0,14961,0,10,0,55,133712,129981,0
"Vaincre le général Vezax après avoir tué l'animus de saronite en mode 10 joueurs.","J'aime l'odeur de la saronite au petit matin (10 joueurs)",,3181,603,-1,0,14961,0,10,0,57,254090,128454,0
"Vaincre Hodir avant qu'il ne détruise sa cache rare en mode 10 joueurs.","Jouons à casse-cache (10 joueurs)",,3182,603,-1,0,14961,0,10,0,39,132597,129983,0
"Vaincre Thorim alors que Sif est présente en mode 25 joueurs.","Bercés d'illusions (25 joueurs)",,3183,603,-1,2978,14962,0,10,0,45,298676,132268,0
"Vaincre Hodir avant qu'il ne détruise sa cache rare en mode 25 joueurs.","Jouons à casse-cache (25joueurs)",,3184,603,-1,0,14962,0,10,0,40,132597,129985,0
"Vaincre Freya alors qu'au moins un ancien est encore vivant en mode 25 joueurs.","L'arbre qui cache la Freya (25 joueurs)",,3185,603,-1,0,14962,0,10,0,50,236437,128062,0
"Vaincre Freya alors qu'au moins deux anciens sont encore vivants en mode 25 joueurs.","Les arbres qui cachent la Freya (25 joueurs)",,3186,603,-1,3185,14962,0,10,0,51,236437,129987,0
"Vaincre Freya alors que les trois anciens sont encore vivants en mode 25 joueurs.","Tous les arbres qui cachent la Freya (25 joueurs)",,3187,603,-1,3186,14962,0,10,0,52,236437,132956,0
"Vaincre le général Vezax après avoir tué l'animus de saronite en mode 25 joueurs.","J'aime l'odeur de la saronite au petit matin (25 joueurs)",,3188,603,-1,0,14962,0,10,0,57,254090,128672,0
"Vaincre Mimiron après avoir activé son mécanisme d'autodestruction en mode 25 joueurs.","Ne jamais toucher au bouton rouge (25 joueurs)",,3189,603,-1,0,14962,0,10,0,55,133712,130339,0
"Fontes apprises","Fontes apprises",,3216,-1,-1,0,173,0,0,1,20,136243,128584,0
"Achever chacune des 5 quêtes journalières de pêche de Marcia Chase listées ci-dessous.","Marcia, elle pêche",,3217,-1,-1,0,171,0,10,0,19,132933,129457,0
"Pêcher une monture tortue de mer dans n'importe quel banc de poissons du Norfendre.","À la pêche à la tortue",,3218,-1,-1,0,171,1,10,0,25,133936,125739,0
"Morts d'Emalon le Guetteur d'orage (Joug-d'hiver à 25)","Morts d'Emalon le Guetteur d'orage (Joug-d'hiver à 25)",,3236,624,-1,0,14963,0,10,1,30,135836,132994,0
"Vaincre Mimiron sans qu'un seul membre du raid soit victime de ce qui suit, en mode 25 joueurs.","Bombe aisée réussie (25 joueurs)",,3237,603,-1,0,14962,0,10,0,53,236221,128858,0
"Victoires contre Hodir (Ulduar à 25)","Victoires contre Hodir (Ulduar à 25)",,3256,603,-1,0,14963,0,10,1,22,134155,132992,0
"Victoires contre Thorim (Ulduar à 25)","Victoires contre Thorim (Ulduar à 25)",,3257,603,-1,0,14963,0,10,1,23,134155,128124,0
"Victoires contre Freya (Ulduar à 25)","Victoires contre Freya (Ulduar à 25)",,3258,603,-1,0,14963,0,10,1,24,134155,131987,0
"Avoir participé au premier raid du royaume ayant vaincu Algalon l'Observateur en mode 25 joueurs.","Défenseur céleste « Prem's » du royaume","Titre : défenseur céleste",3259,603,-1,0,81,0,0,768,70,254087,132456,0
"Obtenir une toque de chef.","Cuisiner avec classe",,3296,-1,-1,0,170,0,10,0,25,236571,127017,0
"Vaincre Algalon l'observateur à 10 sans qu'un seul membre du raid porte d'équipement avec un niveau d'objet supérieur à ce qui est disponible dans Ulduar pour 10.","Héraut des titans","Titre : héraut des titans",3316,603,-1,0,14961,0,10,0,70,254087,133385,0
"Avoir obtenu le titre de gladiateur fatal.","Gladiateur fatal",,3336,-1,-1,0,81,0,0,0,154,236537,128880,0
"Obtenir un sabre-de-givre de Berceau-de-l'Hiver.","Sabre-de-givre de Berceau-de-l'Hiver",,3356,-1,1,0,81,1,0,0,182,132252,132054,0
"Obtenir un Ravasaure peau-de-venin.","Ravasaure peau-de-venin",,3357,-1,0,0,81,2,0,0,183,132193,132360,0
"Avoir obtenu le titre de gladiateur furieux.","Gladiateur furieux",,3436,-1,-1,0,81,0,0,0,155,236538,132074,0
"Danser avec Catrina pour être transformé en squelette au cours du Jour des morts.","La fête du mort",,3456,-1,-1,0,155,0,10,0,14,237272,132366,0
"Boire avec le capitaine DeMeza de l'effroi pour rejoindre son équipage pendant le Jour des pirates.","Le butin du capitaine",,3457,-1,-1,0,155,0,10,0,9,133168,132368,0
"Accomplir les hauts faits des Bienfaits du pèlerin listés ci-dessous.",Pèlerin,"Récompenses : titre de pèlerin et cage à dinde",3478,-1,1,0,155,0,10,0,15,250626,133228,0
"Obtenir une monture épique de la fête des Brasseurs.","Monture dé-bourrée",,3496,-1,-1,0,81,1,0,0,181,132620,133004,0
"Morts dans Ulduar","Morts dans Ulduar",,3516,-1,-1,0,125,0,0,1,13,136243,133007,0
"Être l'heureux propriétaire de l'œuf de murloc lourd de Grognie, obtenu lors de la Blizzcon 2009.","Le marine marin",,3536,-1,-1,0,81,1,0,0,83,132834,133009,0
"Acquérir l'Esprit du partage grâce à un festin complet à la table des Bienfaits dans chaque capitale de l'Alliance.","La panse du pèlerin",,3556,-1,1,0,14981,0,10,0,4,237414,132099,0
"Acquérir l'Esprit du partage grâce à un festin complet à la table des Bienfaits dans chaque capitale de la Horde.","La panse du pèlerin",,3557,-1,0,0,14981,0,10,0,5,237414,132649,0
"Faire passer chacun des plats de la table des Bienfaits.","La part du pèlerin",,3558,-1,-1,0,14981,0,10,0,10,135928,132749,0
"Canardez ces sales petits voleurs avec votre dindoflingue.",Dindonisés,,3559,-1,-1,0,14981,0,10,0,13,135434,132755,0
"Cuisiner chacun des plats des Bienfaits du pèlerin.","Maintenant, on peut cuisiner !",,3576,-1,1,0,14981,0,10,0,2,236571,133095,0
"Cuisiner chacun des plats des Bienfaits du pèlerin.","Maintenant, on peut cuisiner !",,3577,-1,0,0,14981,0,10,0,3,236571,133101,0
"Chasser suffisamment de dindes sauvages pour obtenir le Dindocide !","Le dindonator",,3578,-1,-1,0,14981,0,10,0,12,132210,133107,0
"Jetez de la nourriture au visage d'un convive installé autour de la table des Bienfaits.","Bataille de nourriture !",,3579,-1,-1,0,14981,1,10,0,1,132333,133109,0
"Vêtu d'une tenue, d'une robe ou d'un costume de pèlerin, prenez place autour de la table des Bienfaits de chaque capitale ennemie.","Le péril du pèlerin",,3580,-1,1,0,14981,0,10,0,6,132485,133191,0
"Vêtu d'une tenue, d'une robe ou d'un costume de pèlerin, prenez place autour de la table des Bienfaits de chaque capitale ennemie.","Le péril du pèlerin",,3581,-1,0,0,14981,0,10,0,7,132486,133031,0
"Vaincre le roi-serre Ikiss, coiffé d'un chapeau de pélerin et vêtu d'une tenue, d'une robe ou d'un costume de pèlerin.","La dinde de Draenor",,3582,-1,-1,0,14981,0,10,0,11,236435,132314,0
"Achever chacune des quêtes journalières des Bienfaits du pèlerin.","Le pèlerinage du pèlerin",,3596,-1,1,0,14981,0,10,0,8,133167,132104,0
"Achever chacune des quêtes journalières des Bienfaits du pèlerin.","Le pèlerinage du pèlerin",,3597,-1,0,0,14981,0,10,0,9,133167,132998,0
"Être l'heureux propriétaire de Bourbimus le Gladiateur.","Bourbimus le Gladiateur",,3618,-1,-1,0,81,1,0,0,177,135128,132323,0
"Se connecter pendant l'offre du tigre de jade.","Tigre de jade",,3636,-1,-1,0,81,0,0,0,178,134134,132654,0
"Accomplir les hauts faits des Bienfaits du pèlerin listés ci-dessous.",Pèlerin,"Récompenses : titre de pèlerin et cage à dinde",3656,-1,0,0,155,0,10,0,16,250626,132958,0
"Être exalté auprès du Concordat argenté et obtenir le droit de représenter une ville au tournoi d'Argent.","Le confident argenté","Nouvelles quêtes journalières auprès du Concordat argenté au tournoi d'Argent",3676,-1,1,0,14941,0,10,0,33,132849,132224,0
"Être exalté auprès des Saccage-soleil et obtenir le droit de représenter une ville au tournoi d'Argent.","Les Saccage-soleil","Nouvelles quêtes journalières auprès des Saccage-soleil au tournoi d'Argent",3677,-1,0,0,14941,0,10,0,34,132850,132656,0
"Acheter un poney d'Argent à Dame Evniki Kapsalis, l'intendante du croisé, et l'utiliser.","Mon joli poney",,3736,-1,-1,0,14941,0,10,0,6,132261,132227,0
"Obtenir le wyrm de givre du gladiateur furieux de la sixième saison d'arène de Wrath of the Lich King.","Wyrm de givre du gladiateur furieux",,3756,-1,-1,0,81,1,0,0,138,303868,133090,0
"Obtenir le wyrm de givre du gladiateur implacable de la septième saison d'arène de Wrath of the Lich King.","Wyrm de givre du gladiateur implacable",,3757,-1,-1,0,81,1,0,0,139,303868,132659,0
"Avoir obtenu le titre de gladiateur implacable.","Gladiateur implacable",,3758,-1,-1,0,81,0,0,0,156,236539,133040,0
"Gagner la bataille pour l'île des Conquérants","Victoire à l'île des Conquérants",,3776,628,-1,0,15003,0,10,0,1,237453,132110,0
"Obtenir 100 victoires sur l'île des Conquérants.","Vétéran de l'île des Conquérants",,3777,628,-1,3776,15003,0,10,0,2,236382,132662,0
"Vaincre les boss de L'épreuve du champion","L'épreuve du champion",,3778,650,0,0,14806,0,10,0,13,135128,132245,0
"Vaincre Glace-hurlante avec 2 frigbolds toujours vivants en mode 10 joueurs.","Mal de dos (10 joueurs)",,3797,-1,-1,0,15001,1,10,0,3,132387,132721,0
"Vaincre les héros ennemis en 60 secondes après que le premier a été tué en mode 10 joueurs.","La résilience va arranger ça (10 joueurs)",,3798,-1,-1,0,15001,1,10,0,6,236339,132593,0
"Vaincre les jumelles val'kyrs en 3 minutes maximum en mode 10 joueurs.","Poivre et sel (10 joueurs)",,3799,-1,-1,0,15001,1,10,0,7,298674,132076,0
"Tuer 40 scarabées d'essaim en 30 secondes en mode 10 joueurs.","Le roi traître (10 joueurs)",,3800,-1,-1,0,15001,0,10,0,8,298643,132742,0
"Au cours de différentes tentatives de l'épreuve du croisé, vaincre le confesseur d'argent Paletress après avoir supprimé cinq différents souvenirs du passé en mode héroïque.","Confesseur d'argent",,3802,-1,-1,0,14921,5,10,0,60,133154,132521,0
"Vaincre Eadric le Pur dans l'épreuve du champion avec son propre marteau en mode héroïque.","Un marteau pour les pwner tous",,3803,-1,-1,0,14921,0,10,0,61,132326,132933,0
"Vaincre le Chevalier noir dans l'épreuve du croisé en mode héroïque sans qu'un seul joueur du groupe soit touché par une explosion de goule.","J'ai connu pire",,3804,-1,-1,0,14921,0,10,0,62,133125,132700,0
"Durant l'épreuve du grand croisé, atteindre un coffre d'offrande alors qu'il vous reste 25 tentatives en mode 10 joueurs.","Une offrande au talent (10 joueurs)",,3808,-1,-1,0,15001,1,10,0,9,132770,132327,0
"Durant l'épreuve du grand croisé, atteindre un coffre d'offrande alors qu'il vous reste 45 tentatives en mode 10 joueurs.","Une offrande au talent fou (10 joueurs)",,3809,-1,-1,3808,15001,1,10,0,10,132771,133028,0
"Durant l'épreuve du grand croisé, atteindre un coffre d'offrande alors qu'il vous reste 50 tentatives en mode 10 joueurs.","Une offrande à la démence (10 joueurs)",,3810,-1,-1,3809,15001,0,10,0,11,132769,132726,0
"Vaincre tous les boss de l'épreuve du grand croisé en mode héroïque à 25.","L'appel de la grande Croisade (25 joueurs)",,3812,-1,-1,0,15002,0,10,0,2,236689,132410,0
"Vaincre Glace-hurlante avec 4 frigbolds toujours vivants en mode 25 joueurs.","Mal de dos (25 joueurs)",,3813,-1,-1,0,15002,1,10,0,3,132387,132096,0
"Vaincre les héros ennemis dans les 60 secondes qui suivent la mort du premier en mode 25 joueurs.","La résilience va arranger ça (25 joueurs)",,3814,-1,-1,0,15002,1,10,0,6,236339,132935,0
"Vaincre les jumelles val'kyrs en 3 minutes maximum en mode 25 joueurs.","Poivre et sel (25 joueurs)",,3815,-1,-1,0,15002,1,10,0,7,298674,132938,0
"Tuer 40 scarabées d'essaim en 30 secondes en mode 25 joueurs.","Le roi traître (25 joueurs)",,3816,-1,-1,0,15002,0,10,0,8,298643,132127,0
"Durant l'épreuve du grand croisé, atteindre un coffre d'offrande alors qu'il vous reste 25 tentatives en mode 25 joueurs.","Une offrande au talent (25 joueurs)",,3817,-1,-1,0,15002,1,10,0,9,132770,132728,0
"Durant l'épreuve du grand croisé, atteindre un coffre d'offrande alors qu'il vous reste 45 tentatives en mode 25 joueurs.","Une offrande au talent fou (25 joueurs)",,3818,-1,-1,3817,15002,1,10,0,10,132771,132941,0
"Durant l'épreuve du grand croisé, atteindre un coffre d'offrande alors qu'il vous reste 50 tentatives en mode 25 joueurs.","Une offrande à la démence (25 joueurs)",,3819,-1,-1,3818,15002,0,10,0,11,132769,132291,0
"Vaincre Koralon le gardien des flammes à 10.","Koralon le gardien des flammes (10 joueurs)",,3836,624,-1,0,14901,0,10,0,20,135829,132408,0
"Vaincre Koralon le gardien des flammes à 25.","Koralon le gardien des flammes (25 joueurs)",,3837,624,-1,0,14901,0,10,0,21,135829,133012,0
"Ramasser un emblème d'héroïsme, de vaillance, de conquête, de triomphe ou de givre.","Emblème de donjon ou de raid",,3838,-1,-1,0,168,0,10,8,13,135901,132944,0
"Ramasser 25 emblèmes d'héroïsme, de vaillance, de conquête, de triomphe ou de givre.","25 emblèmes de donjon ou de raid",,3839,-1,-1,3838,168,0,10,136,14,135901,132596,0
"Ramasser 50 emblèmes d'héroïsme, de vaillance, de conquête, de triomphe ou de givre.","50 emblèmes de donjon ou de raid",,3840,-1,-1,3839,168,0,10,136,15,135901,132679,0
"Ramasser 100 emblèmes d'héroïsme, de vaillance, de conquête, de triomphe ou de givre.","100 emblèmes de donjon ou de raid",,3841,-1,-1,3840,168,0,10,136,16,135901,132129,0
"Ramasser 250 emblèmes d'héroïsme, de vaillance, de conquête, de triomphe ou de givre.","250 emblèmes de donjon ou de raid",,3842,-1,-1,3841,168,0,10,136,17,135901,132715,0
"Ramasser 500 emblèmes d'héroïsme, de vaillance, de conquête, de triomphe ou de givre.","500 emblèmes de donjon ou de raid",,3843,-1,-1,3842,168,0,10,136,18,135901,133022,0
"Ramasser 1 000 emblèmes d'héroïsme, de vaillance, de conquête, de triomphe ou de givre.","1 000 emblèmes de donjon ou de raid",,3844,-1,-1,3843,168,0,10,136,19,135901,132135,0
"Dans une même bataille pour l'île des Conquérants, attaquer une base, en défendre une, détruire un véhicule et tuer un personnage-joueur.","Vedette de l'île des Conquérants",,3845,628,-1,0,15003,0,20,0,3,135919,133125,0
"Gagner sur l'île des Conquérants alors que votre équipe contrôle la carrière et la raffinerie.","Gavage de ressources",,3846,628,1,0,15003,0,10,0,4,133026,132732,0
"Sur l'île des Conquérants, contrôler les véhicules suivants :","Collectionnite aiguë",,3847,628,-1,0,15003,0,10,0,8,132996,132141,0
"Dans une même bataille pour l'île des Conquérants, utiliser 5 bombes d'hydroglycérine contre les portes ennemies.",A-bomb-inable,,3848,628,-1,0,15003,0,10,0,9,133709,132834,0
"Dans une même bataille pour l'île des Conquérants, utiliser 5 énormes bombes d'hydroglycérine contre les portes ennemies.",A-bomb-ination,,3849,628,-1,0,15003,0,10,0,10,133710,132675,0
"Sur l'île des Conquérants, détruire 10 véhicules et tuer 100 personnages-joueurs à l'aide de tourelles.",Fauchés,,3850,628,-1,0,15003,0,10,0,11,134291,132146,0
"Gagner sur l'île des Conquérants en ayant le contrôle de la carrière, de la raffinerie, des docks, de l'atelier de siège et du hangar.","Elle est à moi !",,3851,628,1,3846,15003,0,10,0,5,133228,132950,0
"Désarmer 25 bombes sur l'île des Conquérants.","Le fil vert sur le bouton vert, le fil rouge…",,3852,628,-1,0,15003,0,10,0,12,133713,132254,0
"Dans une même bataille pour l'île des Conquérants, tuer un personnage-joueur dans chacun des lieux suivants :","Présent sur toute l'île",,3853,628,-1,0,15003,0,10,0,13,135672,133014,0
"Sur l'île des Conquérants, pénétrer dans la cour ennemie alors que la porte tient toujours.","Entrons par la petite porte",,3854,-1,-1,0,15003,0,10,0,14,252175,132256,0
"Sur l'île des Conquérants, tuer 10 personnages-joueurs à l'aide d'un lanceur de glaive sans mourir.","Le glaive sonne le glas",,3855,628,-1,0,15003,0,10,0,17,132330,132677,0
"Détruire les véhicules suivants sur l'île des Conquérants.","Derby démolisseur",,3856,-1,1,0,15003,0,10,0,15,133035,133242,0
"Accomplir les hauts faits de l'île des Conquérants listés ci-dessous.","Maître de l'île des Conquérants","Récompense : tabard de conquête",3857,-1,1,0,15003,0,25,0,18,236396,132602,0
"Ramasser 1 500 emblèmes d'héroïsme, de vaillance, de conquête, de triomphe ou de givre.","1500 emblèmes de donjon ou de raid",,3876,-1,-1,3844,168,0,10,136,20,135901,133361,0
"Être l'heureux propriétaire d'une panthère onyx.","Panthère onyx",,3896,-1,-1,0,81,0,0,0,179,134399,132460,0
"Vaincre tous les boss de l'épreuve du croisé en mode 25 joueurs.","L'appel de la Croisade (25 joueurs)",,3916,-1,-1,0,15002,0,10,0,1,236689,132828,0
"Vaincre tous les boss de l'épreuve du croisé en mode 10 joueurs.","L'appel de la Croisade (10 joueurs)",,3917,-1,-1,0,15001,0,10,0,1,236689,125013,0
"Vaincre tous les boss de l'épreuve du grand croisé en mode héroïque à 10.","L'appel de la grande Croisade (10 joueurs)",,3918,-1,-1,0,15001,0,10,0,2,236689,132450,0
"Vaincre Gueule-d'acide et Écaille-d'effroi à moins de 10 secondes d'intervalle en mode 10 joueurs.","Pas un, mais deux jormungars (10 joueurs)",,3936,-1,-1,0,15001,1,10,0,4,236197,132387,0
"Vaincre Gueule-d'acide et Écaille-d'effroi à moins de 10 secondes d'intervalle en mode 25 joueurs.","Pas un, mais deux jormungars (25 joueurs)",,3937,-1,-1,0,15002,1,10,0,4,236197,132390,0
"Accomplir les hauts faits de l'île des Conquérants listés ci-dessous.","Maître de l'île des Conquérants","Récompense : tabard de conquête",3957,-1,0,0,15003,0,25,0,19,236396,132784,0
"Vaincre le seigneur Jaraxxus alors qu'au moins deux maîtresses de Douleur sont toujours vivantes en mode 10 joueurs.","Pointe de douleur aiguë (10 joueurs)",,3996,-1,-1,0,15001,1,10,0,5,136202,132953,0
"Vaincre le seigneur Jaraxxus alors qu'au moins deux maîtresses de Douleur sont toujours vivantes en mode 25 joueurs.","Pointe de douleur aiguë (25 joueurs)",,3997,-1,-1,0,15002,1,10,0,5,136202,132836,0
"Vaincre Archavon le Gardien des pierres, Emalon le Guetteur d'orage et Koralon le Veilleur des flammes à 60 secondes d'intervalle en mode 10 joueurs.","Boucherie sans eau (10 joueurs)",,4016,-1,-1,0,14922,0,10,0,34,136029,133187,0
"Vaincre Archavon le Gardien des pierres, Emalon le Guetteur d'orage et Koralon le Veilleur des flammes à 60 secondes d'intervalle en mode 25joueurs.","Boucherie sans eau (25 joueurs)",,4017,-1,-1,0,14923,0,10,0,34,136029,132503,0
"Victoires sur le champion chasseur (L'épreuve du champion)","Victoires sur le champion chasseur (L'épreuve du champion)",,4018,-1,-1,0,15021,0,0,1,1,136243,133247,0
"Victoires sur le champion chasseur (L'épreuve du champion héroïque)","Victoires sur le champion chasseur (L'épreuve du champion héroïque)",,4019,-1,-1,0,15021,0,0,1,2,136243,132782,0
"Victoires sur le confesseur d'argent Paletress (L'épreuve du champion héroïque)","Victoires sur le confesseur d'argent Paletress (L'épreuve du champion héroïque)",,4022,-1,-1,0,15021,0,0,1,11,136243,133115,0
"Victoires sur le confesseur d'argent Paletress (L'épreuve du champion héroïque)","Victoires sur le confesseur d'argent Paletress (L'épreuve du champion héroïque)",,4023,-1,-1,0,15021,0,0,1,12,136243,133130,0
"Victoires sur Eadric le Pur (L'épreuve du champion)","Victoires sur Eadric le Pur (L'épreuve du champion)",,4024,-1,-1,0,15021,0,0,1,13,136243,133200,0
"Victoires sur Eadric le Pur (L'épreuve du champion héroïque)","Victoires sur Eadric le Pur (L'épreuve du champion héroïque)",,4025,-1,-1,0,15021,0,0,1,14,136243,133020,0
"Morts du Chevalier noir (L'épreuve du champion)","Morts du Chevalier noir (L'épreuve du champion)",,4026,-1,-1,0,15021,0,0,1,15,136243,133249,0
"Morts du Chevalier noir (L'épreuve du champion héroïque)","Morts du Chevalier noir (L'épreuve du champion héroïque)",,4027,-1,-1,0,15021,0,0,1,16,136243,132724,0
"Victoires sur les bêtes du Norfendre (L'épreuve du croisé à 10 joueurs)","Victoires sur les bêtes du Norfendre (L'épreuve du croisé à 10 joueurs)",,4028,-1,-1,0,15021,0,0,1,17,136243,132260,0
"Victoires sur les bêtes du Norfendre (L'épreuve du grand croisé à 25 joueurs)","Victoires sur les bêtes du Norfendre (L'épreuve du grand croisé à 25 joueurs)",,4029,-1,-1,0,15021,0,0,1,20,136243,133251,0
"Victoires sur les bêtes du Norfendre (L'épreuve du grand croisé à 10 joueurs)","Victoires sur les bêtes du Norfendre (L'épreuve du grand croisé à 10 joueurs)",,4030,-1,-1,0,15021,0,0,1,18,136243,132519,0
"Victoires sur les bêtes du Norfendre (L'épreuve du croisé à 25 joueurs)","Victoires sur les bêtes du Norfendre (L'épreuve du croisé à 25 joueurs)",,4031,-1,-1,0,15021,0,0,1,19,136243,133253,0
"Morts du seigneur Jaraxxus (L'épreuve du croisé à 10 joueurs)","Morts du seigneur Jaraxxus (L'épreuve du croisé à 10 joueurs)",,4032,-1,-1,0,15021,0,0,1,21,136243,133387,0
"Morts du seigneur Jaraxxus (L'épreuve du grand croisé à 10 joueurs)","Morts du seigneur Jaraxxus (L'épreuve du grand croisé à 10 joueurs)",,4033,-1,-1,0,15021,0,0,1,22,136243,133257,0
"Morts du seigneur Jaraxxus (L'épreuve du croisé à 25 joueurs)","Morts du seigneur Jaraxxus (L'épreuve du croisé à 25 joueurs)",,4034,-1,-1,0,15021,0,0,1,23,136243,132505,0
