Description_lang,Title_lang,Reward_lang,ID,Instance_ID,Faction,Supercedes,Category,Minimum_criteria,Points,Flags,Ui_order,IconFileID,Criteria_tree,Shares_criteria
"Achever les quêtes JcJ journalières des Grisonnes listées ci-dessous.","Vétéran grisé",,2016,-1,1,0,95,0,10,0,41,236776,128718,0
"Achever les quêtes JcJ journalières des Grisonnes listées ci-dessous.","Vétéran grisé",,2017,-1,0,0,95,0,10,0,42,236776,132154,0
"Achever les quêtes journalières en donjons du Norfendre listées ci-dessous.","Prévisions de Timear",,2018,-1,-1,0,81,0,0,0,186,135737,132065,0
"Avoir achevé les quêtes journalières en donjons du Norfendre listées ci-dessous.","Preuves de la mort",,2019,-1,-1,0,81,0,0,0,187,133074,131991,0
"Vaincre Keristrasza dans le Nexus sans que Froid intense s'empile plus de deux fois en mode héroïque.","Froid intense",,2036,576,-1,0,14921,0,10,0,24,236208,128701,0
"Vaincre Anomalus dans le Nexus sans détruire de failles chaotiques en mode héroïque.","La théorie du chaos",,2037,576,-1,0,14921,0,10,0,25,236496,132070,0
"Vaincre l'ancien Nadox à Ahn'kahet sans tuer de gardien ahn'kahar en mode héroïque.","Respecter ses anciens",,2038,619,-1,0,14921,0,10,0,30,237373,132393,0
"Attaquer le roi Dred dans le donjon de Drak'Tharon et tuer 6 arrache-tripes drakkari ou faucheurs drakkari pendant le combat en mode héroïque.","Tombé Dred mort",,2039,600,-1,0,14921,0,10,0,33,236192,133255,0
"Vaincre Moorabi à Gundrak en l'empêchant de se transformer en mammouth tout au long du combat en mode héroïque.",Moin-rabi,,2040,604,-1,0,14921,0,10,0,41,237399,132079,0
"Vaincre Ichoron dans le fort Pourpre sans que des globules d'ichor fusionnent en mode héroïque.",Déshydratation,,2041,608,-1,0,14921,0,10,0,37,135862,132081,0
"Vaincre Volkhan dans les salles de Foudre sans qu'il brise plus de 4 golems vermoulus en mode héroïque.",Incassables,,2042,602,-1,0,14921,0,10,0,48,135818,128856,0
"Forcer Svala Tristetombe à tuer un butor du Fléau sur la cime d'Utgarde en mode héroïque.","Butez le butor",,2043,575,-1,0,14921,0,10,0,51,136219,132310,0
"Vaincre le gardien-tellurique Eregos dans l'Oculus sans qu'un seul membre du groupe utilise de drake rubis en mode héroïque.","Le vide rubis",,2044,578,-1,0,14921,0,10,0,57,236234,128264,0
"Vaincre le gardien-tellurique Eregos dans l'Oculus sans qu'un seul membre du groupe utilise de drake émeraude en mode héroïque.","Le vide émeraude",,2045,578,-1,0,14921,0,10,0,58,236231,132270,0
"Vaincre le gardien-tellurique Eregos dans l'Oculus sans qu'un seul membre du groupe utilise de drake ambre en mode héroïque.","Le vide ambre",,2046,578,-1,0,14921,0,10,0,59,236232,130218,0
"Vaincre Sartharion le Gardien d'Onyx sans être touché par Frappe de lave en mode 10 joueurs.","Éruption volcanique (10 joueurs)",,2047,615,-1,0,14922,0,10,0,26,237583,130220,0
"Vaincre Sartharion le Gardien d'Onyx sans être touché par Frappe de lave en mode 25 joueurs.","Éruption volcanique (25 joueurs)",,2048,615,-1,0,14923,0,10,0,26,237583,132272,0
"Attaquer et vaincre Sartharion le Gardien d'Onyx, alors qu'au moins un drake crépusculaire est toujours vivant en mode 10 joueurs.","Aide crépusculaire (10 joueurs)",,2049,615,-1,0,14922,0,10,0,27,236473,130222,0
"Attaquer et vaincre Sartharion le Gardien d'Onyx, alors qu'au moins deux drakes crépusculaires sont toujours vivants en mode 10 joueurs.","Duo crépusculaire (10 joueurs)",,2050,615,-1,0,14922,0,10,0,28,236473,129771,0
"Attaquer et vaincre Sartharion le Gardien d'Onyx, alors que les trois drakes crépusculaires sont toujours vivants en mode 10 joueurs.","Les chroniques des crépusculaires (10 joueurs)","Titre : du crépuscule",2051,615,-1,0,14922,0,10,0,29,236473,128741,0
"Attaquer et vaincre Sartharion le Gardien d'Onyx, alors qu'au moins un drake crépusculaire est toujours vivant en mode 25 joueurs.","Aide crépusculaire (25 joueurs)",,2052,615,-1,0,14923,0,10,0,27,236473,132306,0
"Attaquer et vaincre Sartharion le Gardien d'Onyx, alors qu'au moins deux drakes crépusculaires sont toujours vivants en mode 25 joueurs.","Duo crépusculaire (25 joueurs)",,2053,615,-1,0,14923,0,10,0,28,236473,132312,0
"Attaquer et vaincre Sartharion le Gardien d'Onyx, alors que les trois drakes crépusculaires sont toujours vivants en mode 25 joueurs.","Les chroniques des crépusculaires (25 joueurs)","Titre : vainqueur du crépuscule",2054,615,-1,0,14923,0,10,0,29,236473,129069,0
"Vaincre Jedoga Cherchelombre à Ahn'kahet sans tuer de volontaires du crépuscule en mode héroïque.","Sur la base du volontariat",,2056,619,-1,0,14921,0,10,0,31,236451,129077,0
"Vaincre Novos l'Invocateur dans le donjon de Drak'Tharon sans que des sbires morts-vivants atteignent le sol en mode héroïque.","Novos l'Invocateur",,2057,600,-1,0,14921,0,10,0,34,237511,128739,0
"Vaincre Slad'ran à Gundrak sans se faire enrouler par des serpents en mode héroïque.","Des serpents, fallait que ce soit des serpents !",,2058,604,-1,0,14921,0,10,0,42,236177,132028,0
"Obtenir un ours brun cuirassé auprès de Mei Francis à Dalaran.","Ours brun cuirassé",,2076,-1,-1,0,92,1,10,0,45,236244,128266,0
"Obtenir un mammouth laineux auprès de Mei Francis à Dalaran.","Mammouth laineux",,2077,-1,-1,0,92,1,10,0,46,236239,132336,0
"Obtenir un mammouth de voyage de la toundra auprès de Mei Francis à Dalaran.","Mammouth de voyage de la toundra",,2078,-1,-1,0,92,1,10,0,47,236239,132339,0
"Avoir obtenu un tabard du protecteur lors de l’ouverture de la Porte des ténèbres.","Tabard du protecteur",,2079,-1,-1,0,81,0,0,0,167,135026,128568,0
"Obtenir un mammouth de guerre noir.","Mammouth de guerre noir",,2080,-1,-1,0,14901,1,10,0,10,236237,132342,0
"Obtenir un grand mammouth de guerre noir.","Grand mammouth de guerre noir",,2081,-1,-1,0,81,1,0,0,180,236237,132345,0
"Obtenir un mammouth des glaces.","Mammouth des glaces",,2082,-1,-1,0,14866,1,10,0,12,236241,133334,0
"Obtenir un grand mammouth des glaces.","Grand mammouth des glaces",,2083,-1,-1,0,14866,1,10,0,13,236241,123961,0
"Acheter une chevalière du Kirin Tor, une bague du Kirin Tor, un jonc du Kirin Tor ou un anneau du Kirin Tor à Dalaran.","Anneau du Kirin Tor",,2084,-1,-1,0,92,1,10,0,49,133415,128064,0
"Ramasser 50 éclats du gardien des pierres.","50 éclats du gardien des pierres",,2085,-1,-1,0,14901,0,10,0,11,134375,132348,0
"Ramasser 100 éclats du gardien des pierres.","100 éclats du gardien des pierres",,2086,-1,-1,2085,14901,0,10,0,12,134375,128670,0
"Ramasser 250 éclats du gardien des pierres.","250 éclats du gardien des pierres",,2087,-1,-1,2086,14901,0,10,0,13,134375,133346,0
"Ramasser 500 éclats du gardien des pierres.","500 éclats du gardien des pierres",,2088,-1,-1,2087,14901,0,10,0,14,134375,132308,0
"Ramasser 1 000 éclats du gardien des pierres.","1 000 éclats du gardien des pierres",,2089,-1,-1,2088,14901,0,10,0,15,134375,128732,0
"Obtenir le titre de compétiteur lors d'une saison d'arène au niveau 80.",Compétiteur,,2090,-1,-1,0,165,1,10,0,21,236537,140608,0
"Se connecter pendant le 4e anniversaire de WoW.","4e anniversaire de WoW",,2398,-1,-1,0,81,0,0,0,169,133783,124569,0
"Obtenir le titre de gladiateur lors d'une saison d'arène au niveau 80.",Gladiateur,,2091,-1,-1,0,165,1,10,0,24,236540,140590,0
"Obtenir le titre de duelliste lors d'une saison d'arène au niveau 80.",Duelliste,,2092,-1,-1,0,165,1,10,0,23,236539,140595,0
"Obtenir le titre de rival lors d'une saison d'arène au niveau 80.",Rival,,2093,-1,-1,0,165,1,10,0,22,236538,140601,0
"Pêcher les pièces de cuivre listées ci-dessous dans la fontaine de Dalaran.","Une pièce de cuivre contre vos pensées",,2094,571,-1,0,171,0,10,0,21,237283,129463,0
"Pêcher les pièces d'argent listées ci-dessous dans la fontaine de Dalaran.","L'argent coule à flots",,2095,571,-1,0,171,0,10,0,22,237282,128273,0
"Accomplir les hauts faits de pêche de pièces listés ci-dessous.","Le maître des pièces","Récompense : sceau de Dalaran en titane",2096,-1,-1,0,171,0,10,0,32,133785,129486,0
"Obtenir une bécane de mekgénieur ou une mécabécane.","T'as vu ma bécane !",,2097,-1,-1,0,92,1,10,0,48,134248,129697,0
"Avoir obtenu un tabard de l'Aube d'argent lors de l'invasion du Fléau.","Tabard de l'Aube d'argent",,2116,-1,-1,0,81,0,0,0,168,135026,128633,0
"Accomplir les hauts faits dans les donjons héroïques listés ci-dessous.","Gloire au héros","Récompense : proto-drake rouge",2136,-1,-1,0,168,0,25,0,23,133127,128130,0
"Accomplir les hauts faits dans les raids à 10 listés ci-dessous.","Gloire à l'écumeur de raids (10 joueurs)","Récompense : proto-drake pestiféré",2137,-1,-1,0,168,0,25,0,24,133124,129490,0
"Accomplir les hauts faits dans les raids à 25 listés ci-dessous.","Gloire à l'écumeur de raids (25 joueurs)","Récompense : proto-drake noir",2138,-1,-1,0,168,0,25,0,25,133074,128609,0
"Vaincre Heigan l'Impur à Naxxramas sans que quiconque meure en mode 25 joueurs.","La danse de la sûreté (25 joueurs)",,2139,533,-1,0,14923,0,10,0,13,132301,133357,0
"Vaincre la grande veuve Faerlina à Naxxramas sans dissiper ou empêcher la frénésie en mode 25 joueurs.","La veuve joyeuse (25 joueurs)",,2140,-1,-1,0,14923,0,10,0,14,136138,128002,0
"Obtenir 10 montures.","Gardien d'écuries",,2141,-1,-1,0,92,0,10,0,51,132254,128627,0
"Obtenir 25 montures.","L'écurie se remplit",,2142,-1,-1,2141,92,0,10,0,52,132259,128000,0
"Obtenir 50 montures.","À la tête de la cavalerie","Récompense : drake albinos",2143,-1,-1,2142,92,0,10,0,53,236237,128629,0
"Accomplir les hauts faits des évènements mondiaux listés ci-dessous.","Voyages au bout du monde","Récompense : proto-drake pourpre",2144,-1,1,0,155,0,50,0,19,236369,127991,0
"Accomplir les hauts faits des évènements mondiaux listés ci-dessous.","Voyages au bout du monde","Récompense : proto-drake pourpre",2145,-1,0,0,155,0,50,0,20,236369,133348,0
"Vaincre Saphiron à Naxxramas sans qu'un seul membre du raid ait plus de 100 à la résistance au givre en mode 10 joueurs.","Le club des cent (10 joueurs)",,2146,533,-1,0,14922,0,10,0,19,134155,132304,0
"Vaincre Saphiron à Naxxramas sans qu'un seul membre du raid ait plus de 100 à la résistance au givre en mode 25 joueurs.","Le club des cent (25 joueurs)",,2147,533,-1,0,14923,0,10,0,19,134155,132300,0
"Infliger un coup fatal à un scion de l'Éternité tout en chevauchant un disque en suspension en mode 10 joueurs.","La répression des scions (10 joueurs)",,2148,616,-1,0,14922,0,10,0,25,132843,132990,0
"Infliger un coup fatal à un scion de l'Éternité tout en chevauchant un disque en suspension en mode 25 joueurs.","La répression des scions (25 joueurs)",,2149,616,-1,0,14923,0,10,0,25,132843,130216,0
"Vaincre le grand magus Telestra dans le Nexus après avoir tué ses images à 5 secondes d'intervalle pendant ses deux dédoublements en mode héroïque.","Dédoublement de personnalité",,2150,-1,-1,0,14921,0,10,0,23,236496,129081,0
"Vaincre Trollétripe dans le donjon de Drak'Tharon avant que Consumer ne s'empile dix fois en mode héroïque.","Consumé par l'ambition",,2151,600,-1,0,14921,0,10,0,32,250120,129067,0
"Vaincre Gal'darah à Gundrak alors que les cinq personnages du groupe se sont fait empaler au cours du combat en mode héroïque.","L'amour est partout",,2152,604,-1,0,14921,0,10,0,40,132246,128551,0
"Vaincre Zuramat l'Oblitérateur dans le fort Pourpre sans tuer de factionnaire du Vide en mode héroïque.","La danse du vide",,2153,608,-1,0,14921,0,10,0,38,132886,129700,0
"Vaincre les ennemis du tribunal des Âges dans les salles de Pierre sans que Brann Barbe-de-bronze subisse des dégâts en mode héroïque.","Au nez et à la barbe de Brann",,2154,599,-1,0,14921,0,10,0,45,236444,129628,0
"Vaincre Sjonnir le Sculptefer dans les salles de Pierre et tuer 5 vases de fer pendant la rencontre en mode héroïque.","Éliminons les limons",,2155,599,-1,0,14921,0,10,0,44,134437,128128,0
"Vaincre Skadi le Brutal sur la cime d'Utgarde après avoir tué Grauf en une seule phase en mode héroïque.","La cascade de Skadi",,2156,575,-1,0,14921,0,10,0,53,236419,128324,0
"Vaincre le roi Ymiron sur la cime d'Utgarde sans qu'un seul membre du groupe déclenche Plaie en mode héroïque.","La plaie des rois",,2157,575,-1,0,14921,0,10,0,54,236421,128269,0
"Vaincre les 4 cavaliers à Naxxramas à moins de 15 secondes d'intervalle les uns des autres en mode 10 joueurs.","Jusqu'à ce que mort s'ensuive (10 joueurs)",,2176,533,-1,0,14922,0,10,0,18,237534,132350,0
"Vaincre les 4 cavaliers à Naxxramas à moins de 15 secondes d'intervalle les uns des autres en mode 25 joueurs.","Jusqu'à ce que mort s'ensuive (25 joueurs)",,2177,533,-1,0,14923,0,10,0,18,237534,131989,0
"Vaincre Thaddius à Naxxramas sans que quiconque traverse les charges positives et négatives en mode 10 joueurs.","Et c'est le choc ! (10 joueurs)",,2178,533,-1,0,14922,0,10,0,15,135769,128607,0
"Vaincre Thaddius à Naxxramas sans que quiconque traverse les charges positives et négatives en mode 25 joueurs.","Et c'est le choc ! (25 joueurs)",,2179,533,-1,0,14923,0,10,0,15,135769,132397,0
"Vaincre Thaddius à Naxxramas à 8 maximum en mode 10 joueurs.","Soustraction (10 joueurs)",,2180,533,-1,0,14922,0,10,0,16,135768,128271,0
"Vaincre Thaddius à Naxxramas à 20 maximum en mode 25 joueurs.","Soustraction (25 joueurs)",,2181,533,-1,0,14923,0,10,0,16,135768,128306,0
"Vaincre Horreb à Naxxramas sans tuer une seule spore en mode 10 joueurs.","On ne plaisante pas avec les spores (10 joueurs)",,2182,533,-1,0,14922,0,10,0,17,134220,129083,0
"Vaincre Horreb à Naxxramas sans tuer une seule spore en mode 25 joueurs.","On ne plaisante pas avec les spores (25 joueurs)",,2183,533,-1,0,14923,0,10,0,17,134220,129788,0
"Vaincre Kel'Thuzad en ayant tué au moins 18 abominations dans sa chambre en mode 10 joueurs.","On n'en a jamais assez (10 joueurs)",,2184,533,-1,0,14922,0,10,0,20,135774,132822,0
"Vaincre Kel'Thuzad en ayant tué au moins 18 abominations dans sa chambre en mode 25 joueurs.","On n'en a jamais assez (25 joueurs)",,2185,533,-1,0,14923,0,10,0,20,135774,132824,0
"Entre deux réinitialisations de raids, vaincre chaque boss de Naxxramas sans qu'un seul membre du raid meure au cours des combats contre les boss en mode 25 joueurs.","Il en restera plus d'un","Titre : l'immortel",2186,533,-1,0,14923,1,10,0,21,135986,129071,0
"Entre deux réinitialisations de raids, vaincre chaque boss de Naxxramas sans qu'un seul membre du raid meure au cours des combats contre les boss en mode 10 joueurs.",Increvables,"Titre : l'increvable",2187,533,-1,0,14922,1,10,0,21,135969,128300,0
"Tuer 50 dragonnets de la colonie en 15 secondes.",Leeeeeeeeeeeeeroy !,"Titre : Jenkins",2188,229,-1,0,14808,0,10,0,26,236234,132685,0
"Détruire 5 véhicules à l'aide d'une tourelle dans un même champ de bataille.","Expert en artillerie",,2189,607,-1,0,14881,0,10,0,12,132385,128308,0
"Tuer 5 personnages transportant de l'hydroglycérine au cours d'un même champ de bataille.","Lâche ça tout de suite !",,2190,607,-1,0,14881,0,10,0,14,236272,132970,0
"Tuer 100 personnages dans la cour des Anciens.","Protecteur de la cour des Anciens",,2191,607,-1,0,14881,0,10,0,16,132282,132871,0
"Gagner une bataille pour le rivage des Anciens sans perdre un seul véhicule de siège.","Même pas mal",,2192,607,0,0,14881,0,10,0,10,132337,132972,0
"Poser 5 charges d'hydroglycérine qui endommagent un mur avec succès au cours d'un même champ de bataille.","Expert en explosifs",,2193,607,-1,0,14881,0,10,0,8,133713,132974,0
"Accomplir les hauts faits du rivage des Anciens listés ci-dessous.","Maîtrise du rivage des Anciens",,2194,-1,1,0,14881,0,25,0,17,236394,132976,0
"Accomplir les hauts faits du rivage des Anciens listés ci-dessous.","Maîtrise du rivage des Anciens",,2195,-1,0,0,14881,0,25,0,18,236394,128310,0
"Tuer 10 personnages dans chacune des zones de Joug-d'hiver listées ci-dessous.","Forestier de Joug-d'hiver",,2199,571,-1,0,14901,0,10,0,4,236224,129630,0
"Défendre la plage sans perdre un seul mur","La défense des anciens",,2200,607,0,0,14881,0,10,0,6,132341,132869,0
"Boss de donjon de Lich King le plus mortel","Boss de donjon de Lich King le plus mortel",,2216,-1,-1,0,125,0,0,17,7,136243,128004,322
"Boss de raid à 10 de Lich King le plus mortel","Boss de raid à 10 de Lich King le plus mortel",,2217,-1,-1,0,125,0,0,17,9,136243,129641,323
"Boss de raid à 25 de Lich King le plus mortel","Boss de raid à 25 de Lich King le plus mortel",,2218,-1,-1,0,125,0,0,17,11,136243,132873,324
"Morts dans des donjons héroïques à 5","Morts dans des donjons héroïques à 5",,2219,-1,-1,0,125,0,0,1,3,136243,132865,0
"Tuer l'une des créatures du Norfendre très rares et difficiles à trouver listées ci-dessous.","Exposition nord",,2256,-1,-1,0,14780,1,10,0,10,236834,132796,0
"Tuer toutes les créatures du Norfendre très rares et difficiles à trouver listées ci-dessous.","Froid mordant",,2257,-1,-1,2256,14780,0,25,0,11,236751,132565,2256
"Invocations acceptées","Invocations acceptées",,2277,-1,-1,0,134,0,0,1,2,136243,132820,0
"Obtenir le drake du Néant brutal de la quatrième saison d'arène de The Burning Crusade.","Drake du Néant brutal",,2316,-1,-1,0,81,1,0,0,136,132249,121806,0
"Être honoré auprès de la Voile sanglante et exalté auprès de Baie-du-Butin, Long-Guet, Gadgetzan, Cabestan, la foire de Sombrelune, Ravenholdt et Shen’dralar.","Tous des malades","Titre : le grand malade",2336,-1,-1,0,81,0,0,0,171,236206,143660,0
"Avoir achevé la quête de démoniste « Le destrier de l'effroi de Xoroth ».","Destrier de l'effroi de Xoroth",,2357,-1,-1,0,81,0,0,0,173,132238,121782,0
"Avoir achevé la quête de paladin pour obtenir un destrier.",Destrier,,2358,-1,-1,0,81,1,0,0,175,132226,121912,0
"Avoir achevé la quête de druide pour obtenir la forme de vol rapide.","Forme de vol rapide",,2359,-1,-1,0,81,0,0,0,176,132128,132030,0
"Champ de bataille le plus disputé","Champ de bataille le plus disputé",,2396,-1,-1,0,153,0,0,17,2,136243,124578,839
"Champ de bataille le plus remporté","Champ de bataille le plus remporté",,2397,-1,-1,0,153,0,0,17,4,136243,132293,840
"Pondre un œuf aux sources de Golakka dans le cratère d'Un'Goro en étant déguisé en lapin, pendant les festivités du Jardin des nobles.","Œuf dur",,2416,-1,-1,0,159,0,10,0,6,236998,129444,0
"Manger 25 chocolats du Jardin des nobles pendant la fête du Jardin des nobles.","Tendrement chocolat",,2417,-1,-1,0,159,0,10,0,2,236570,132089,0
"Manger 100 chocolats du Jardin des nobles pendant la fête du Jardin des nobles.","C'est fort en chocolat",,2418,-1,-1,2417,159,0,10,0,3,236570,132032,0
"Trouvez à votre compagnon lapin du printemps une âme soeur dans chacune des villes ci-dessous.","Amourette de printemps",,2419,-1,1,0,159,0,10,0,7,237000,129729,0
"Cacher un œuf vivement coloré à Lune-d'argent.","Le Jardin des nobles",,2420,-1,0,0,159,0,10,0,9,236997,132149,0
"Cacher un œuf vivement coloré à Hurlevent.","Le Jardin des nobles",,2421,-1,1,0,159,0,10,0,10,236997,129946,0
"Utiliser les fleurs printanières pour placer des oreilles de lapin sur des personnages-joueurs de niveau 18 minimum.","C'est moi qui pose les lapins",,2422,-1,-1,0,159,0,10,0,11,133939,128289,0
"Utiliser la Robe du printemps pour planter une fleur dans chacun des déserts cités ci-dessous.","Rose des sables",,2436,-1,-1,0,159,0,10,0,12,237578,129734,0
"Avoir tué le prince Tenris Bourbassang et obtenu son familier, la chauve-souricette vampirique.","Tueur de vampires",,2456,-1,-1,0,81,1,0,0,172,132182,126295,0
"Détruire chacun des véhicules listés ci-dessous.","Derby destructeur",,2476,571,0,0,14901,0,10,0,6,135783,128257,0
"Obtenir une quintessence aquatique.","Le cinquième élément",,2496,-1,-1,0,81,0,0,0,174,135862,129792,0
"Trouvez à votre compagnon lapin du printemps une âme soeur dans chacune des villes ci-dessous.","Amourette de printemps",,2497,-1,0,0,159,0,10,0,8,237000,131932,0
"Collecter 75 mascottes différentes.","La chasse au p'tit gibier","Récompense : morceau de sel du petit faon",2516,-1,-1,1250,92,0,10,0,27,132599,132931,0
"Obtenir 100 montures.","Une montagne de montures","Récompense : faucon-dragon de monte bleu",2536,-1,1,2143,92,0,10,0,54,132188,129938,0
"Obtenir 100 montures.","Une montagne de montures","Récompense : faucon-dragon de monte rouge",2537,-1,0,2143,92,0,10,0,55,132188,129944,0
"Tuer les nuisibles listés ci-dessous.",Désinsectisation,,2556,-1,-1,0,92,0,10,0,39,132196,128220,0
"Montrer tout votre /amour à encore plus de bestioles d'Azeroth.","À tous les écureuils qui ont partagé ma vie",,2557,-1,-1,0,92,0,10,0,38,237182,128241,0
"Embrasser quelqu'un portant une robe de soirée alors que vous portez une chemise blanche de smoking et un pantalon de smoking noir.","Jeune mariée",,2576,-1,-1,0,159,0,10,0,13,136209,129446,0
"Morts de M. Bigglesworth","Morts de M. Bigglesworth",,2596,533,-1,0,14823,0,10,33,40,134155,132151,0
"Trouvez un œuf vivement coloré.","J'en ai un !",,2676,-1,-1,0,159,0,10,0,1,237000,129418,0
"Rendez-vous auprès de votre maître de classe à partir du niveau 40 et activez la double spécialisation des talents.","Double spécialisation des talents",,2716,-1,-1,0,92,0,10,0,50,236544,128587,0
"S'entraîner pour concourir au tournoi d'Argent en devenant un aspirant pour la faction de votre race.","L'aspiration à l'Argent",,2756,-1,-1,0,14941,1,10,0,1,236690,131464,0
"S'entraîner pour concourir au tournoi d'Argent en devenant un vaillant pour la faction de votre race.","La valeur de l'Argent",,2758,-1,-1,2756,14941,1,10,0,2,236689,129369,0
"Être exalté auprès de Darnassus et obtenir le droit de représenter la faction au tournoi d'Argent.","Champion exalté de Darnassus","Titre : de Darnassus",2760,-1,1,2777,14941,0,10,0,8,255141,128598,0
"Être exalté auprès de l'Exodar et obtenir le droit de représenter la faction au tournoi d'Argent.","Champion exalté de l'Exodar","Titre : de l'Exodar",2761,-1,1,2778,14941,0,10,0,10,255137,126336,0
"Être exalté auprès des exilés de Gnomeregan et obtenir le droit de représenter la faction au tournoi d'Argent.","Champion exalté de Gnomeregan","Titre : de Gnomeregan",2762,-1,1,2779,14941,0,10,0,12,255139,128604,0
"Être exalté auprès de Forgefer et obtenir le droit de représenter la faction au tournoi d'Argent.","Champion exalté de Forgefer","Titre : de Forgefer",2763,-1,1,2780,14941,0,10,0,14,255138,128059,0
"Être exalté auprès de Hurlevent et obtenir le droit de représenter la faction au tournoi d'Argent.","Champion exalté de Hurlevent","Titre : de Hurlevent",2764,-1,1,2781,14941,0,10,0,16,255140,131976,0
"Être exalté auprès d'Orgrimmar et obtenir le droit de représenter la faction au tournoi d'Argent.","Champion exalté d'Orgrimmar","Titre : d'Orgrimmar",2765,-1,0,2783,14941,0,10,0,21,255142,126429,0
"Être exalté auprès de Sen'jin et obtenir le droit de représenter la faction au tournoi d'Argent.","Champion exalté de Sen'jin","Titre : de Sen'jin",2766,-1,0,2784,14941,0,10,0,23,255145,128601,0
"Être exalté auprès de Lune-d'argent et obtenir le droit de représenter la faction au tournoi d'Argent.","Champion exalté de Lune-d'argent","Titre : de Lune-d'argent",2767,-1,0,2785,14941,0,10,0,25,255136,128562,0
"Être exalté auprès des Pitons du Tonnerre et obtenir le droit de représenter la faction au tournoi d'Argent.","Champion exalté des Pitons du Tonnerre","Titre : des Pitons du Tonnerre",2768,-1,0,2786,14941,0,10,0,27,255144,128565,0
"Morts d'Algalon l'Observateur (Ulduar à 10)","Morts d'Algalon l'Observateur (Ulduar à 10)",,2867,603,-1,0,14963,0,10,1,14,134155,132620,0
"Être exalté auprès de Fossoyeuse et obtenir le droit de représenter la faction au tournoi d'Argent.","Champion exalté de Fossoyeuse","Titre : de Fossoyeuse",2769,-1,0,2787,14941,0,10,0,29,255143,126432,0
"Être exalté auprès de l'Alliance et obtenir le droit d'en représenter chaque race au tournoi d'Argent.","Champion exalté de l'Alliance",,2770,-1,1,2782,14941,0,10,0,18,255130,129392,0
"Être exalté auprès de la Horde et obtenir le droit d'en représenter chaque race au tournoi d'Argent.","Champion exalté de la Horde",,2771,-1,0,2788,14941,0,10,0,31,255132,128651,0
"Vaincre un personnage-joueur en duel monté au tournoi d'Argent.",Désarçonné !,,2772,-1,-1,0,14941,0,10,0,3,135128,129390,0
"Démasquer et vaincre le Chevalier noir au tournoi d'Argent","Une simple blessure",,2773,-1,-1,0,14941,0,10,0,5,133146,128699,0
"Accomplir les hauts faits de Joug-d'hiver listés ci-dessous.","Maîtrise de Joug-d'hiver",,2776,-1,0,0,14901,0,10,0,25,135836,126958,0
"Obtenir le droit de représenter Darnassus au tournoi d'Argent","Champion de Darnassus",,2777,-1,1,0,14941,0,10,0,7,255141,128697,0
"Obtenir le droit de représenter l'Exodar au tournoi d'Argent","Champion de l'Exodar",,2778,-1,1,0,14941,0,10,0,9,255137,124928,0
"Obtenir le droit de représenter les exilés de Gnomeregan au tournoi d'Argent","Champion de Gnomeregan",,2779,-1,1,0,14941,0,10,0,11,255139,125116,0
"Obtenir le droit de représenter Forgefer au tournoi d'Argent","Champion de Forgefer",,2780,-1,1,0,14941,0,10,0,13,255138,131979,0
"Obtenir le droit de représenter Hurlevent au tournoi d'Argent","Champion de Hurlevent",,2781,-1,1,0,14941,0,10,0,15,255140,124488,0
"Obtenir le droit de représenter chaque race de l'Alliance au tournoi d'Argent","Champion de l'Alliance",,2782,-1,1,0,14941,0,10,0,17,255130,125118,0
"Obtenir le droit de représenter Orgrimmar au tournoi d'Argent","Champion d'Orgrimmar",,2783,-1,0,0,14941,0,10,0,20,255142,132072,0
"Obtenir le droit de représenter Sen'jin au tournoi d'Argent","Champion de Sen'jin",,2784,-1,0,0,14941,0,10,0,22,255145,124490,0
"Obtenir le droit de représenter Lune-d'argent au tournoi d'Argent","Champion de Lune-d'argent",,2785,-1,0,0,14941,0,10,0,24,255136,128456,0
